{
  "part": {
    "part_id": "USB-HUB-PLATE-SIM",
    "package_slug": "usb-hub-plate-simulated",
    "revision": "B",
    "name": "USB hub synthetic plate",
    "description": "Explicit synthetic requirements for software revision-impact/reinspection planning only. Not a released manufacturing specification or physical inspection record.",
    "material": null,
    "process": null
  },
  "geometry_source": {
    "path": "output/usb-hub-portfolio-VAokFT/rev-b/usb_hub_surrogate_B.step",
    "file_type": "step",
    "revision": "B",
    "source_sha256": "729e4e755265e7e386040bc5f820b8034235eb10a811e2ef0c036bdbb03eeabe"
  },
  "bom": [],
  "inspection_results": [],
  "quality_issues": [],
  "manufacturing_context": {
    "notes": "Explicit synthetic requirements for software revision-impact/reinspection planning only. Not a released manufacturing specification or physical inspection record."
  },
  "metadata": {
    "created_at": "2026-09-25T12:05:57.707Z",
    "source_files": [
      "output/usb-hub-portfolio-VAokFT/rev-b/config.toml",
      "output/usb-hub-portfolio-VAokFT/rev-b/usb_hub_surrogate_B.step",
      "docs/portfolio/usb-hub-plate-change/inputs/revision-contract.json"
    ],
    "provenance": {
      "test_scope": "synthetic_portfolio_case",
      "production_trust": false,
      "original_config_sha256": "5d02a61fc45456d5b2b61e0b78553bada7529485697a544c89eb5e49f450ebc3",
      "model_sha256": "729e4e755265e7e386040bc5f820b8034235eb10a811e2ef0c036bdbb03eeabe",
      "requirements_sha256": "bcee36f9a6f663220b892223210e3f0987926791a17ba6c8cf04acd632dbfd08",
      "comparison_config_sha256": "bb32ae2311fce02320030988e8fbd7df49a22109125835b3325fed24aa5a4dfa"
    },
    "warnings": [
      "SIMULATED - NOT FOR FABRICATION. No physical inspection, released tolerances, or inspection method."
    ]
  }
}
